{
  "pageType": "hybrid",
  "confidence": 0.96,
  "typography": {
    "sourceFontVerified": false,
    "styles": [
      {
        "styleId": "diagram-label",
        "fontFamily": "Noto Sans CJK SC",
        "fontSizePt": 14,
        "bold": false
      }
    ]
  },
  "regions": [
    {
      "id": "fixture-flow",
      "type": "flowchart",
      "bbox": [0.07, 0.18, 0.55, 0.30],
      "recommendedAction": "semantic-rebuild",
      "confidence": 0.95,
      "reconstructionComplete": true,
      "expectedObjectCount": 3,
      "coverFill": "#F5F7FA",
      "objects": [
        {
          "id": "vision-source-node",
          "type": "shape",
          "geometry": "roundRect",
          "bbox": [0.09, 0.25, 0.18, 0.11],
          "fill": "#4472C4",
          "line": {
            "fill": "#4472C4",
            "width": 1
          },
          "text": "源节点",
          "textEvidenceId": "p01-e0000"
        },
        {
          "id": "vision-target-node",
          "type": "shape",
          "geometry": "roundRect",
          "bbox": [0.37, 0.25, 0.18, 0.11],
          "fill": "#FFE699",
          "line": {
            "fill": "#C9A227",
            "width": 1
          },
          "text": "目标节点",
          "textEvidenceId": "p01-e0001"
        },
        {
          "id": "vision-source-to-target",
          "type": "connector",
          "bbox": [0.27, 0.28, 0.10, 0.02],
          "from": "vision-source-node",
          "to": "vision-target-node",
          "kind": "straight",
          "line": {
            "fill": "#202020",
            "width": 1
          },
          "head": {
            "type": "triangle"
          }
        }
      ]
    }
  ]
}
